# name: test/sql/fts/test_layered_search.test
# description: Layered BM25 search sidecar and incremental maintenance
# group: [fts]

require skip_reload

require fts

require no_alternative_verify

statement ok
CREATE TABLE documents(id VARCHAR NOT NULL, body VARCHAR, author VARCHAR)

statement ok
INSERT INTO documents VALUES
    ('doc1', 'quacking quacking quacking', 'Hannes'),
    ('doc2', 'barking barking barking barking', 'Mark'),
    ('doc3', 'meowing meowing meowing meowing meowing 999', 'Laurens')

statement ok
PRAGMA create_fts_index('documents', 'id', 'body', 'author', stemmer='none', stopwords='none', ignore='(\\.|[^a-z0-9])+', layered_search=true, incremental=true)

query I
SELECT count(*) FROM fts_main_documents.term_stats
----
7

query I
SELECT CASE WHEN count(*) > 0 THEN 1 ELSE 0 END FROM fts_main_documents.term_grams
----
1

query I
SELECT count(*)
FROM fts_main_documents.term_grams AS tg
JOIN fts_main_documents.term_stats AS ts USING (termid)
WHERE ts.term = '999'
----
0

query I
SELECT count(*)
FROM (
    SELECT termid, lag(termid) OVER () AS previous_termid
    FROM fts_main_documents.terms
) ordered_terms
WHERE previous_termid IS NOT NULL
  AND termid < previous_termid
----
0

query I
SELECT docname
FROM fts_main_documents.search_layered_bm25('quack', fields := 'body', enable_short_fuzzy := false)
----
doc1

query I
SELECT id
FROM (
    SELECT *,
           fts_main_documents.match_layered_bm25(id, 'quack', fields := 'body', enable_short_fuzzy := false) AS score
    FROM documents
) sq
WHERE score IS NOT NULL
ORDER BY score DESC
----
doc1

query I
SELECT docname
FROM fts_main_documents.search_layered_bm25('mark', fields := 'author', enable_short_fuzzy := false)
----
doc2

query I
SELECT docname
FROM fts_main_documents.search_layered_bm25('999', fields := 'body', enable_short_fuzzy := false)
----
doc3

statement ok
INSERT INTO documents VALUES ('doc4', 'chirping chirping', 'Mark')

statement ok
INSERT INTO documents VALUES ('doc5', 'singing', 'Marker')

query II
SELECT term, df
FROM fts_main_documents.term_stats
WHERE term IN ('chirping', 'mark')
ORDER BY term
----
chirping	1
mark	2

query I rowsort
SELECT docname
FROM fts_main_documents.search_layered_bm25('mark', fields := 'author', enable_short_fuzzy := false, expand_exact_terms := false)
----
doc2
doc4

query I rowsort
SELECT docname
FROM fts_main_documents.search_layered_bm25('mark', fields := 'author', enable_short_fuzzy := false, expand_exact_terms := true)
----
doc2
doc4
doc5

query I
SELECT CASE WHEN count(*) > 0 THEN 1 ELSE 0 END
FROM fts_main_documents.term_grams AS tg
JOIN fts_main_documents.term_stats AS ts USING (termid)
WHERE ts.term = 'chirping'
----
1

query I
SELECT docname
FROM fts_main_documents.search_layered_bm25('chirp', fields := 'body', enable_short_fuzzy := false)
----
doc4

statement ok
DELETE FROM documents WHERE id = 'doc3'

query I
SELECT count(*) FROM fts_main_documents.term_stats WHERE term = 'meowing'
----
0

query I
SELECT count(*)
FROM fts_main_documents.term_grams AS tg
LEFT JOIN fts_main_documents.term_stats AS ts USING (termid)
WHERE ts.termid IS NULL
----
0

query I
SELECT count(*)
FROM fts_main_documents.search_layered_bm25('meow', fields := 'body', enable_short_fuzzy := false)
----
0

statement ok
CREATE TABLE plain_documents(id VARCHAR, body VARCHAR)

statement ok
INSERT INTO plain_documents VALUES ('doc1', 'alpha beta')

statement ok
PRAGMA create_fts_index('plain_documents', 'id', 'body', stemmer='none', stopwords='none')

query I
SELECT count(*)
FROM information_schema.tables
WHERE table_schema = 'fts_main_plain_documents'
  AND table_name = 'term_stats'
----
0

statement ok
CREATE TABLE static_layered_documents(id VARCHAR, body VARCHAR)

statement ok
INSERT INTO static_layered_documents VALUES ('doc1', 'alpha alpha')

statement ok
PRAGMA create_fts_index('static_layered_documents', 'id', 'body', stemmer='none', stopwords='none', layered_search=true)

query I
SELECT count(*)
FROM information_schema.tables
WHERE table_schema = 'fts_main_static_layered_documents'
  AND table_name = 'term_stats'
----
1

query I
SELECT docname
FROM fts_main_static_layered_documents.search_layered_bm25('alpha', enable_short_fuzzy := false)
----
doc1

statement ok
INSERT INTO static_layered_documents VALUES ('doc2', 'beta')

query I
SELECT count(*)
FROM fts_main_static_layered_documents.search_layered_bm25('beta', enable_short_fuzzy := false)
----
0

statement ok
CREATE TABLE lifecycle_docs(id VARCHAR NOT NULL, body VARCHAR)

statement ok
INSERT INTO lifecycle_docs VALUES ('doc1', 'alpha beta')

statement ok
PRAGMA create_fts_index('lifecycle_docs', 'id', 'body', stemmer='none', stopwords='none', layered_search=true, incremental=true)

query I
SELECT count(*)
FROM information_schema.tables
WHERE table_schema = 'fts_main_lifecycle_docs'
  AND table_name = 'term_stats'
----
1

query I
SELECT CASE WHEN count(*) > 0 THEN 1 ELSE 0 END
FROM duckdb_triggers()
WHERE trigger_name LIKE '__fts_fts_main_lifecycle_docs_%term_stats%'
----
1

statement ok
PRAGMA create_fts_index('lifecycle_docs', 'id', 'body', stemmer='none', stopwords='none', overwrite=true, incremental=true)

query I
SELECT count(*)
FROM information_schema.tables
WHERE table_schema = 'fts_main_lifecycle_docs'
  AND table_name = 'term_stats'
----
0

query I
SELECT count(*)
FROM duckdb_triggers()
WHERE trigger_name LIKE '__fts_fts_main_lifecycle_docs_%term_stats%'
----
0

statement ok
PRAGMA drop_fts_index('lifecycle_docs')

query I
SELECT count(*)
FROM duckdb_schemas()
WHERE schema_name = 'fts_main_lifecycle_docs'
----
0

query I
SELECT count(*)
FROM duckdb_triggers()
WHERE trigger_name LIKE '__fts_fts_main_lifecycle_docs_%'
----
0

statement ok
CREATE TABLE "layered docs"(id VARCHAR NOT NULL, "bo""dy" VARCHAR)

statement ok
INSERT INTO "layered docs" VALUES ('docq', 'quoted quoted')

statement ok
PRAGMA create_fts_index('"layered docs"', 'id', 'bo"dy', stemmer='none', stopwords='none', layered_search=true, incremental=true)

query I
SELECT docname
FROM "fts_main_layered docs".search_layered_bm25('quote', fields := 'bo"dy', enable_short_fuzzy := false)
----
docq

statement ok
ATTACH ':memory:' AS layered_attach

statement ok
CREATE TABLE layered_attach.main.docs(id VARCHAR NOT NULL, body VARCHAR)

statement ok
INSERT INTO layered_attach.main.docs VALUES ('doca', 'attached attached')

statement ok
PRAGMA create_fts_index(layered_attach.main.docs, 'id', 'body', stemmer='none', stopwords='none', layered_search=true)

query I
SELECT docname
FROM layered_attach.fts_main_docs.search_layered_bm25('attach', enable_short_fuzzy := false)
----
doca

statement ok
CREATE TABLE english_stopword_docs(id VARCHAR, body VARCHAR)

statement ok
INSERT INTO english_stopword_docs VALUES ('doc1', 'theme theme'), ('doc2', 'the theme')

statement ok
PRAGMA create_fts_index('english_stopword_docs', 'id', 'body', stemmer='none', stopwords='english', layered_search=true)

query I
SELECT count(*)
FROM fts_main_english_stopword_docs.search_layered_bm25('the', enable_short_fuzzy := false)
----
0

query I
SELECT count(*)
FROM fts_main_english_stopword_docs.search_layered_bm25('the theme', enable_short_fuzzy := false)
----
2

statement ok
CREATE TABLE no_stopword_docs(id VARCHAR, body VARCHAR)

statement ok
INSERT INTO no_stopword_docs VALUES ('doc1', 'the theme')

statement ok
PRAGMA create_fts_index('no_stopword_docs', 'id', 'body', stemmer='none', stopwords='none', layered_search=true)

query I
SELECT docname
FROM fts_main_no_stopword_docs.search_layered_bm25('the', enable_short_fuzzy := false)
----
doc1

statement ok
CREATE TABLE custom_stopwords(sw VARCHAR)

statement ok
INSERT INTO custom_stopwords VALUES ('noise')

statement ok
CREATE TABLE custom_stopword_docs(id VARCHAR, body VARCHAR)

statement ok
INSERT INTO custom_stopword_docs VALUES ('doc1', 'noisy noisy')

statement ok
PRAGMA create_fts_index('custom_stopword_docs', 'id', 'body', stemmer='none', stopwords='custom_stopwords', layered_search=true)

query I
SELECT count(*)
FROM fts_main_custom_stopword_docs.search_layered_bm25('noise', enable_short_fuzzy := false)
----
0

statement ok
CREATE TABLE layered_stem_docs(id VARCHAR, body VARCHAR)

statement ok
INSERT INTO layered_stem_docs VALUES ('doc1', 'preconnectpost')

statement ok
PRAGMA create_fts_index('layered_stem_docs', 'id', 'body', stemmer='porter', stopwords='none', layered_search=true)

query I
SELECT docname
FROM fts_main_layered_stem_docs.search_layered_bm25(
    'connected connection',
    enable_prefix := false,
    enable_substring := true,
    enable_fuzzy := false,
    enable_short_fuzzy := false
)
----
doc1

statement ok
CREATE TABLE layered_limit_docs(id VARCHAR, body VARCHAR)

statement ok
INSERT INTO layered_limit_docs VALUES ('doc1', 'quack'), ('doc2', 'quark')

statement ok
PRAGMA create_fts_index('layered_limit_docs', 'id', 'body', stemmer='none', stopwords='none', layered_search=true)

query I rowsort
SELECT docname
FROM fts_main_layered_limit_docs.search_layered_bm25(
    'quak',
    term_limit := 2,
    enable_prefix := true,
    enable_substring := false,
    enable_fuzzy := true,
    enable_short_fuzzy := true
)
----
doc1
doc2

query I rowsort
SELECT docname
FROM fts_main_documents.search_layered_bm25('mark', fields := ' author ', enable_short_fuzzy := false)
----
doc2
doc4

statement ok
CREATE TABLE autocomplete_docs(id VARCHAR NOT NULL, body VARCHAR, title VARCHAR)

statement ok
INSERT INTO autocomplete_docs VALUES
    ('doc1', 'running', 'alpha'),
    ('doc2', 'runner', 'beta'),
    ('doc3', 'runs', 'alpha'),
    ('doc4', 'run', 'gamma')

statement ok
PRAGMA create_fts_index('autocomplete_docs', 'id', 'body', 'title', stemmer='porter', stopwords='none', layered_search=true, incremental=true)

query I
SELECT count(*) <= 2 * (SELECT count(*) FROM fts_main_autocomplete_docs.raw_dict)
FROM fts_main_autocomplete_docs.term_prefixes
----
true

query I rowsort
SELECT docname
FROM fts_main_autocomplete_docs.search_layered_bm25(
    'runn',
    fields := 'body',
    query_mode := 'autocomplete'
)
----
doc1
doc2

query I rowsort
SELECT docname
FROM fts_main_autocomplete_docs.search_layered_bm25(
    'ru',
    fields := 'body',
    query_mode := 'autocomplete'
)
----
doc1
doc2
doc3
doc4

query I
SELECT count(*)
FROM fts_main_autocomplete_docs.search_layered_bm25(
    'r',
    query_mode := 'autocomplete'
)
----
0

query I rowsort
SELECT docname
FROM fts_main_autocomplete_docs.search_layered_bm25(
    'al',
    fields := 'title',
    max_df_ratio := 1.0,
    query_mode := 'autocomplete'
)
----
doc1
doc3

query I rowsort
SELECT id
FROM (
    SELECT id,
           fts_main_autocomplete_docs.match_layered_bm25(
               id,
               'runn',
               fields := 'body',
               query_mode := 'autocomplete'
           ) AS score
    FROM autocomplete_docs
) AS scored
WHERE score IS NOT NULL
----
doc1
doc2

statement error
SELECT *
FROM fts_main_autocomplete_docs.search_layered_bm25('run', query_mode := 'invalid')
----

statement ok
INSERT INTO autocomplete_docs VALUES ('doc5', 'runnable', 'delta')

query I
SELECT df
FROM fts_main_autocomplete_docs.raw_dict
WHERE raw_term = 'runnable'
----
1

query I rowsort
SELECT docname
FROM fts_main_autocomplete_docs.search_layered_bm25(
    'runn',
    fields := 'body',
    query_mode := 'autocomplete'
)
----
doc1
doc2
doc5

statement ok
DELETE FROM autocomplete_docs WHERE id IN ('doc1', 'doc5')

query I
SELECT count(*)
FROM fts_main_autocomplete_docs.raw_dict
WHERE raw_term IN ('running', 'runnable')
----
0

query I
SELECT count(*)
FROM fts_main_autocomplete_docs.term_prefixes AS tp
LEFT JOIN fts_main_autocomplete_docs.raw_dict AS rd USING (rawtermid)
WHERE rd.rawtermid IS NULL
----
0

query I
SELECT docname
FROM fts_main_autocomplete_docs.search_layered_bm25(
    'runn',
    fields := 'body',
    query_mode := 'autocomplete'
)
----
doc2

# Existing layered indexes can install the structured macros after JSON loads.
require json

statement ok
SELECT json_valid('{}')

statement ok
PRAGMA create_fts_boolean_query_macros('documents')

query I
SELECT docname
FROM fts_main_documents.search_layered_bm25_query(
    '{"query":"quack","fields":["body"]}'::JSON,
    enable_short_fuzzy := false
)
----
doc1
